ID,Categoria,Titulo,Medio,Fecha,Resumen,Comentario_Reaccion,Unnamed: 7,Titulo_longitud,Titulo_num_palabras,Medio_longitud,Medio_num_palabras,Resumen_longitud,Resumen_num_palabras,Comentario_Reaccion_longitud,Comentario_Reaccion_num_palabras,Titulo_limpio,Medio_limpio,Resumen_limpio,Comentario_Reaccion_limpio
132,Frankenstein,"Del Toro en entrevista: ""Es una carta de amor a Mary Shelley""",CinemaBlend,2025-11-07,El director discute la fidelidad al espíritu del libro.,"Respeta la esencia, pero le añade su toque personal.",,61,12,11,1,55,9,52,9,del toro en entrevista es una carta de amor a mary shelley,cinemablend,el director discute la fidelidad al espíritu del libro,respeta la esencia pero le añade su toque personal
133,Generacion Z,Análisis: Las demandas económicas de la Generación Z,Expansión,2025-11-17,Los jóvenes exigen salarios dignos y acceso a la vivienda.,El futuro económico es la mayor preocupación de la Gen Z.,,52,8,9,1,58,10,57,11,análisis las demandas económicas de la generación z,expansión,los jóvenes exigen salarios dignos y acceso a la vivienda,el futuro económico es la mayor preocupación de la gen z
134,Frankenstein,Los 5 momentos más emotivos de Frankenstein (Spoiler Free),BuzzFeed,2025-11-09,Lista de escenas destacadas por su carga dramática.,La escena final me destrozó el corazón.,,58,9,8,1,51,8,39,7,los momentos más emotivos de frankenstein spoiler free,buzzfeed,lista de escenas destacadas por su carga dramática,la escena final me destrozó el corazón
135,Generacion Z,México D.F.: Centro de la protesta juvenil,Reuters,2025-11-16,Cientos se congregan en el Ángel de la Independencia.,El Ángel fue el punto de encuentro de la esperanza.,,42,7,7,1,53,9,51,10,méxico df centro de la protesta juvenil,reuters,cientos se congregan en el ángel de la independencia,el ángel fue el punto de encuentro de la esperanza
136,Frankenstein,¿Habrá secuela? GDT responde,Collider,2025-11-14,Del Toro dice que esta es una historia autocontenida.,"Terminó perfectamente, no necesita más.",,28,4,8,1,53,9,39,5,habrá secuela gdt responde,collider,del toro dice que esta es una historia autocontenida,terminó perfectamente no necesita más
137,Generacion Z,Uso de tecnología para evitar represión policial,VICE News,2025-11-15,Apps de mensajería cifrada y transmisión en vivo para documentar abusos.,El celular es nuestra arma de defensa y denuncia.,,48,7,9,2,72,11,49,9,uso de tecnología para evitar represión policial,vice news,apps de mensajería cifrada y transmisión en vivo para documentar abusos,el celular es nuestra arma de defensa y denuncia
138,Frankenstein,El papel del color y la luz en la película,FilmeNow,2025-11-06,Análisis visual del director de fotografía.,La niebla y la oscuridad son personajes en sí mismos.,,42,10,8,1,43,6,53,10,el papel del color y la luz en la película,filmenow,análisis visual del director de fotografía,la niebla y la oscuridad son personajes en sí mismos
139,Generacion Z,Gobierno acusa vandalismo en monumentos históricos,INAH,2025-11-17,Daños en edificios y estatuas tras los enfrentamientos.,El daño al patrimonio es lamentable.,,50,6,4,1,55,8,36,6,gobierno acusa vandalismo en monumentos históricos,inah,daños en edificios y estatuas tras los enfrentamientos,el daño al patrimonio es lamentable
140,Frankenstein,Estreno de Frankenstein genera debate en Reddit,Reddit r/movies,2025-11-08,Discusión sobre la adaptación y la controversia del casting.,"El debate en Reddit está encendido, es un signo de éxito.",,47,7,15,2,60,9,57,11,estreno de frankenstein genera debate en reddit,reddit rmovies,discusión sobre la adaptación y la controversia del casting,el debate en reddit está encendido es un signo de éxito
141,Generacion Z,Movilización: ¿Una ola organizada o espontánea?,El País,2025-11-18,Expertos debaten la naturaleza del movimiento juvenil.,Es una ola de indignación genuina.,,47,6,7,2,54,7,34,6,movilización una ola organizada o espontánea,el país,expertos debaten la naturaleza del movimiento juvenil,es una ola de indignación genuina
142,Frankenstein,"Actores describen el proceso de maquillaje como ""tortuoso""",The Hollywood Reporter,2025-11-11,Horas de trabajo diario para lograr la apariencia del Monstruo.,"El sacrificio se ve en la pantalla, un trabajo artesanal.",,58,8,22,3,63,10,57,10,actores describen el proceso de maquillaje como tortuoso,the hollywood reporter,horas de trabajo diario para lograr la apariencia del monstruo,el sacrificio se ve en la pantalla un trabajo artesanal
143,Generacion Z,Análisis de lenguaje visual de la protesta,Diseño MX,2025-11-15,Uso de carteles minimalistas y referencias a memes.,Los carteles eran arte puro de protesta.,,42,7,9,2,51,8,40,7,análisis de lenguaje visual de la protesta,diseño mx,uso de carteles minimalistas y referencias a memes,los carteles eran arte puro de protesta
144,Frankenstein,La música de [Compositor] eleva la emoción,Soundtrack World,2025-11-05,Reseña de la banda sonora de la película.,La banda sonora es tan épica como la historia.,,42,7,16,2,41,8,46,9,la música de compositor eleva la emoción,soundtrack world,reseña de la banda sonora de la película,la banda sonora es tan épica como la historia
145,Generacion Z,Jóvenes convocan a una segunda marcha en diciembre,Redes Sociales,2025-11-17,La convocatoria es para el día 10 de diciembre.,"La lucha no termina, apenas comienza.",,50,8,14,2,47,9,37,6,jóvenes convocan a una segunda marcha en diciembre,redes sociales,la convocatoria es para el día de diciembre,la lucha no termina apenas comienza
146,Frankenstein,Comparativa: ¿Mejor que las versiones clásicas?,Den of Geek,2025-11-07,El artículo compara la nueva versión con las de la Universal.,Es la versión que Mary Shelley merecía ver.,,47,6,11,3,61,11,43,8,comparativa mejor que las versiones clásicas,den of geek,el artículo compara la nueva versión con las de la universal,es la versión que mary shelley merecía ver
147,Generacion Z,Marcha: Un grito contra la corrupción y la impunidad,W Radio,2025-11-16,Las demandas centrales giran en torno a la justicia.,La justicia es la base de todo lo que pedimos.,,52,9,7,2,52,9,46,10,marcha un grito contra la corrupción y la impunidad,w radio,las demandas centrales giran en torno a la justicia,la justicia es la base de todo lo que pedimos
148,Frankenstein,"Del Toro sobre la ciencia: ""Es la ambición humana""",Entrevista Televisa,2025-11-04,El director explica su enfoque psicológico del personaje.,La ambición desmedida es el verdadero motor del terror.,,50,9,19,2,57,8,55,9,del toro sobre la ciencia es la ambición humana,entrevista televisa,el director explica su enfoque psicológico del personaje,la ambición desmedida es el verdadero motor del terror
149,Generacion Z,Testimonios: Jóvenes que fueron por primera vez a marchar,Aristegui Noticias,2025-11-18,Historias de la experiencia inicial en las protestas.,"Fue mi primera vez, y no será la última.",,57,9,18,2,53,8,40,9,testimonios jóvenes que fueron por primera vez a marchar,aristegui noticias,historias de la experiencia inicial en las protestas,fue mi primera vez y no será la última
150,Frankenstein,Éxito de taquilla limitada en cines independientes,Box Office Guru,2025-11-13,La película tuvo buenas cifras antes de pasar a streaming.,Un éxito de nicho que se masificó en streaming.,,50,7,15,3,58,10,47,9,éxito de taquilla limitada en cines independientes,box office guru,la película tuvo buenas cifras antes de pasar a streaming,un éxito de nicho que se masificó en streaming
151,Generacion Z,Movilización en Guadalajara y Monterrey,El Norte,2025-11-16,Las protestas se replican en otros estados clave.,La provincia también alza la voz.,,39,5,8,2,49,8,33,6,movilización en guadalajara y monterrey,el norte,las protestas se replican en otros estados clave,la provincia también alza la voz
152,Frankenstein,Del Toro explica el final alternativo,Revista Empire,2025-11-15,Detalles sobre las escenas eliminadas y cambios de guion.,El final elegido es el más coherente con el tono de GDT.,,37,6,14,2,57,9,56,12,del toro explica el final alternativo,revista empire,detalles sobre las escenas eliminadas y cambios de guion,el final elegido es el más coherente con el tono de gdt
153,Generacion Z,Debate en Twitter: ¿Falta de liderazgo en la Gen Z?,El Universal,2025-11-17,Algunos critican la falta de una figura central en el movimiento.,El liderazgo es horizontal en esta generación.,,51,10,12,2,65,11,46,7,debate en twitter falta de liderazgo en la gen z,el universal,algunos critican la falta de una figura central en el movimiento,el liderazgo es horizontal en esta generación
154,Frankenstein,Análisis del vestuario como herramienta narrativa,Vogue México,2025-11-08,La ropa refleja el estatus y la decadencia moral.,El vestuario es un personaje más en la historia.,,49,6,12,2,49,9,48,9,análisis del vestuario como herramienta narrativa,vogue méxico,la ropa refleja el estatus y la decadencia moral,el vestuario es un personaje más en la historia
155,Generacion Z,Reporte: Uso de VPN y Tor para comunicación segura,TechCrunch,2025-11-15,La Gen Z utiliza herramientas digitales para evadir vigilancia.,La protesta se organiza en la sombra digital.,,50,9,10,1,63,9,45,8,reporte uso de vpn y tor para comunicación segura,techcrunch,la gen z utiliza herramientas digitales para evadir vigilancia,la protesta se organiza en la sombra digital
156,Frankenstein,Netflix compra los derechos globales por una cifra millonaria,Deadline,2025-10-25,El acuerdo garantiza una distribución masiva.,"Gracias a Netflix, la obra llegó a todo el mundo.",,61,9,8,1,45,6,49,10,netflix compra los derechos globales por una cifra millonaria,deadline,el acuerdo garantiza una distribución masiva,gracias a netflix la obra llegó a todo el mundo
157,Generacion Z,El lenguaje inclusivo y la Gen Z en la protesta,Cultura Colectiva,2025-11-16,Análisis del vocabulario utilizado en las consignas.,La Gen Z trae consigo el lenguaje de la inclusión.,,47,10,17,2,52,7,50,10,el lenguaje inclusivo y la gen z en la protesta,cultura colectiva,análisis del vocabulario utilizado en las consignas,la gen z trae consigo el lenguaje de la inclusión
158,Frankenstein,"Del Toro sobre el CGI: ""Solo donde sea estrictamente necesario""",Video Production,2025-11-06,Énfasis en los efectos prácticos y la artesanía.,Se agradece el toque práctico y menos digital.,,63,10,16,2,48,8,46,8,del toro sobre el cgi solo donde sea estrictamente necesario,video production,énfasis en los efectos prácticos y la artesanía,se agradece el toque práctico y menos digital
159,Generacion Z,Gobierno acusa a partidos de derecha de infiltrar la marcha,Milenio,2025-11-14,Argumentan que buscan desestabilizar la administración.,Una cortina de humo para no hablar de las demandas.,,59,10,7,1,55,6,51,10,gobierno acusa a partidos de derecha de infiltrar la marcha,milenio,argumentan que buscan desestabilizar la administración,una cortina de humo para no hablar de las demandas
160,Frankenstein,Frankenstein: El monstruo que nos obliga a vernos,Psicología y Cine,2025-11-11,Análisis psicológico de la relación creador-criatura.,El Monstruo es el espejo de nuestra sociedad.,,49,8,17,3,53,6,45,8,frankenstein el monstruo que nos obliga a vernos,psicología y cine,análisis psicológico de la relación creadorcriatura,el monstruo es el espejo de nuestra sociedad
161,Generacion Z,Gen Z crea su propia narrativa en YouTube,YouTube Trends,2025-11-16,Canales de jóvenes documentan la marcha sin filtros.,La información real viene de los jóvenes en el lugar.,,41,8,14,2,52,8,53,10,gen z crea su propia narrativa en youtube,youtube trends,canales de jóvenes documentan la marcha sin filtros,la información real viene de los jóvenes en el lugar
162,Frankenstein,La iluminación como personaje en el film de Del Toro,Cinephilia,2025-11-09,Estudio de cómo el claroscuro define el tono de la película.,Un maestro del contraste y la sombra.,,52,10,10,1,60,11,37,7,la iluminación como personaje en el film de del toro,cinephilia,estudio de cómo el claroscuro define el tono de la película,un maestro del contraste y la sombra
163,Generacion Z,Análisis: Diferencias con el movimiento estudiantil del 68,History Channel,2025-11-18,Comparativa entre el activismo actual y el pasado.,La tecnología es la mayor diferencia con el 68.,,58,8,15,2,50,8,47,9,análisis diferencias con el movimiento estudiantil del,history channel,comparativa entre el activismo actual y el pasado,la tecnología es la mayor diferencia con el
164,Frankenstein,La visión del Dr. Frankenstein como un niño caprichoso,The New Yorker,2025-11-12,Crítica que examina la inmadurez moral del científico.,Un genio con la madurez de un niño.,,54,9,14,3,54,8,35,8,la visión del dr frankenstein como un niño caprichoso,the new yorker,crítica que examina la inmadurez moral del científico,un genio con la madurez de un niño
165,Generacion Z,Reporte de Derechos Humanos condena uso excesivo de la fuerza,Amnistía Internacional,2025-11-17,Documentan agresiones a manifestantes pacíficos.,El derecho a protestar debe ser respetado.,,61,10,22,2,48,5,42,7,reporte de derechos humanos condena uso excesivo de la fuerza,amnistía internacional,documentan agresiones a manifestantes pacíficos,el derecho a protestar debe ser respetado
166,Frankenstein,Guillermo del Toro anuncia un libro de arte de la película,Dark Horse Comics,2025-11-14,El tomo contendrá bocetos y diseños conceptuales.,El arte conceptual es tan bueno como la película.,,58,11,17,3,49,7,49,9,guillermo del toro anuncia un libro de arte de la película,dark horse comics,el tomo contendrá bocetos y diseños conceptuales,el arte conceptual es tan bueno como la película
167,Generacion Z,Economistas advierten sobre el impacto de la inestabilidad social,Financial Times,2025-11-18,Las protestas pueden afectar la inversión extranjera.,La inestabilidad es consecuencia de la crisis social.,,65,9,15,2,53,7,53,8,economistas advierten sobre el impacto de la inestabilidad social,financial times,las protestas pueden afectar la inversión extranjera,la inestabilidad es consecuencia de la crisis social
168,Frankenstein,Frankenstein y el cine gótico: Un regreso a las raíces,Horror Freak,2025-11-05,La película abraza la tradición del horror clásico.,Un festín visual para los amantes del gótico.,,54,10,12,2,51,8,45,8,frankenstein y el cine gótico un regreso a las raíces,horror freak,la película abraza la tradición del horror clásico,un festín visual para los amantes del gótico
169,Generacion Z,Manifestantes utilizan drones para documentar la marcha,Tecnología para el Cambio,2025-11-16,Cámaras aéreas registran la magnitud de la concentración.,Los drones ofrecen una perspectiva imparcial.,,55,7,25,4,57,8,45,6,manifestantes utilizan drones para documentar la marcha,tecnología para el cambio,cámaras aéreas registran la magnitud de la concentración,los drones ofrecen una perspectiva imparcial
170,Frankenstein,"Del Toro agradece el recibimiento: ""Una obra personal""",Discurso de Premiere,2025-10-30,El director se emociona al hablar de su conexión con la historia.,La pasión de GDT se transmite en el cine.,,54,8,20,3,65,12,41,9,del toro agradece el recibimiento una obra personal,discurso de premiere,el director se emociona al hablar de su conexión con la historia,la pasión de gdt se transmite en el cine
171,Generacion Z,Comentarios: La marcha dividió a las familias,Foros de Debate,2025-11-17,Generaciones mayores critican la falta de respeto a la autoridad.,La brecha generacional se hizo más grande en la marcha.,,45,7,15,3,65,10,55,10,comentarios la marcha dividió a las familias,foros de debate,generaciones mayores critican la falta de respeto a la autoridad,la brecha generacional se hizo más grande en la marcha
172,Frankenstein,El Monstruo de Del Toro: ¿El más vulnerable de todos?,Film Comment,2025-11-10,El análisis de la interpretación de [Actor 2] como figura trágica.,Un ser lleno de dolor e inocencia robada.,,53,10,12,2,66,11,41,8,el monstruo de del toro el más vulnerable de todos,film comment,el análisis de la interpretación de actor como figura trágica,un ser lleno de dolor e inocencia robada
173,Generacion Z,Influencers promueven boicot a marcas que no se pronuncian,TikTok,2025-11-15,Piden a las empresas tomar posición política.,Las marcas deben tener responsabilidad social.,,58,9,6,1,45,7,46,6,influencers promueven boicot a marcas que no se pronuncian,tiktok,piden a las empresas tomar posición política,las marcas deben tener responsabilidad social
174,Frankenstein,Frankenstein: Un éxito inesperado de Netflix Latam,Netflix Data,2025-11-14,La película se posiciona como la más vista en la región.,Un triunfo para el cine de autor en streaming.,,50,7,12,2,56,11,46,9,frankenstein un éxito inesperado de netflix latam,netflix data,la película se posiciona como la más vista en la región,un triunfo para el cine de autor en streaming
175,Generacion Z,La voz de la Generación Z en los medios tradicionales,Prensa Libre,2025-11-18,Los medios dan más espacio a las demandas de los jóvenes.,La presión de la calle obliga a los medios a reaccionar.,,53,10,12,2,57,11,56,11,la voz de la generación z en los medios tradicionales,prensa libre,los medios dan más espacio a las demandas de los jóvenes,la presión de la calle obliga a los medios a reaccionar
176,Frankenstein,"Del Toro sobre el final: ""Un toque de esperanza""",Entrevista Exclusiva,2025-11-07,El director defiende un cierre menos nihilista.,"Un final que te deja pensando, pero con luz.",,48,9,20,2,47,7,44,9,del toro sobre el final un toque de esperanza,entrevista exclusiva,el director defiende un cierre menos nihilista,un final que te deja pensando pero con luz
177,Generacion Z,Activistas denuncian detenciones arbitrarias,ONG Derechos Humanos,2025-11-16,Piden la liberación inmediata de los detenidos.,La represión es el peor enemigo de la democracia.,,44,4,20,3,47,7,49,9,activistas denuncian detenciones arbitrarias,ong derechos humanos,piden la liberación inmediata de los detenidos,la represión es el peor enemigo de la democracia
178,Frankenstein,El impacto de la película en la moda gótica actual,Fashionista,2025-11-10,Las tendencias de vestuario de la película inspiran nuevos looks.,El estilo victoriano está de vuelta gracias a Del Toro.,,50,10,11,1,65,10,55,10,el impacto de la película en la moda gótica actual,fashionista,las tendencias de vestuario de la película inspiran nuevos looks,el estilo victoriano está de vuelta gracias a del toro
179,Generacion Z,Análisis de los cánticos y consignas de la marcha,Lingüística Social,2025-11-17,El uso del sarcasmo y el humor negro en las protestas.,Protestar con inteligencia es el sello de la Gen Z.,,49,9,18,2,54,11,51,10,análisis de los cánticos y consignas de la marcha,lingüística social,el uso del sarcasmo y el humor negro en las protestas,protestar con inteligencia es el sello de la gen z
180,Frankenstein,Frankenstein en el Top 10 de IMDb,IMDb Charts,2025-11-15,La película mantiene una alta calificación entre los usuarios.,Una obra maestra que perdurará.,,33,7,11,2,62,9,31,5,frankenstein en el top de imdb,imdb charts,la película mantiene una alta calificación entre los usuarios,una obra maestra que perdurará
181,Generacion Z,Usuarios de Reddit discuten la efectividad de las marchas,Reddit r/Mexico,2025-11-18,Debate sobre si el cambio se logra en la calle o en las urnas.,"La calle mueve la aguja, la urna lo consolida.",,57,9,15,2,62,14,46,9,usuarios de reddit discuten la efectividad de las marchas,reddit rmexico,debate sobre si el cambio se logra en la calle o en las urnas,la calle mueve la aguja la urna lo consolida
182,Frankenstein,La crítica elogia la cinematografía en blanco y negro (Versión especial),Sundance Review,2025-11-12,Se lanzó una edición limitada en blanco y negro para cines.,El B&N intensifica la tragedia.,,72,11,15,2,59,11,31,5,la crítica elogia la cinematografía en blanco y negro versión especial,sundance review,se lanzó una edición limitada en blanco y negro para cines,el bn intensifica la tragedia
183,Generacion Z,Cobertura en vivo de la marcha es la más vista en Facebook,Facebook Live,2025-11-16,Miles de personas siguieron la transmisión en tiempo real.,La transmisión en vivo es la nueva crónica.,,58,12,13,2,58,9,43,8,cobertura en vivo de la marcha es la más vista en facebook,facebook live,miles de personas siguieron la transmisión en tiempo real,la transmisión en vivo es la nueva crónica
184,Frankenstein,"Del Toro: ""Mi Frankenstein no tiene miedo"," tiene dolor""",MasterClass,2025-11-09,El director explica la emoción dominante de la criatura.,El dolor como motor de la monstruosidad.,41,7,13,2,10,1,56,9,del toro mi frankenstein no tiene miedo,tiene dolor,,el director explica la emoción dominante de la criatura
185,Generacion Z,La Generación Z y su relación con el pasado político,Revista Nexos,2025-11-17,Los jóvenes critican a generaciones anteriores por la inacción.,No queremos cometer los mismos errores.,,52,10,13,2,63,9,39,6,la generación z y su relación con el pasado político,revista nexos,los jóvenes critican a generaciones anteriores por la inacción,no queremos cometer los mismos errores
186,Frankenstein,Actriz [Actriz 3] sobre el rol femenino en la historia,Women in Film,2025-11-11,El papel de las mujeres en la nueva adaptación.,Los personajes femeninos son el ancla moral.,,54,10,13,3,47,9,44,7,actriz actriz sobre el rol femenino en la historia,women in film,el papel de las mujeres en la nueva adaptación,los personajes femeninos son el ancla moral
187,Generacion Z,"Marcha es calificada como ""evento generacional""",Analistas Políticos,2025-11-18,Se compara el impacto cultural con el Vive Latino.,Un momento definitorio para la juventud mexicana.,,47,6,19,2,50,9,49,7,marcha es calificada como evento generacional,analistas políticos,se compara el impacto cultural con el vive latino,un momento definitorio para la juventud mexicana
188,Frankenstein,Frankenstein es la película más tuiteada de la semana,Twitter Trends,2025-11-08,Millones de menciones sobre el estreno.,El poder de Del Toro en las redes.,,53,9,14,2,39,6,34,8,frankenstein es la película más tuiteada de la semana,twitter trends,millones de menciones sobre el estreno,el poder de del toro en las redes
189,Generacion Z,Grupos de apoyo legal asisten a detenidos,Pro Bono México,2025-11-16,Abogados ofrecen ayuda gratuita a los arrestados.,La asistencia legal es una forma de protesta.,,41,7,15,3,49,7,45,8,grupos de apoyo legal asisten a detenidos,pro bono méxico,abogados ofrecen ayuda gratuita a los arrestados,la asistencia legal es una forma de protesta
190,Frankenstein,Del Toro elogia la actuación de [Actor 4] como Henry Clerval,Entrevista Backstage,2025-11-07,El director destaca el soporte emocional del personaje.,Clerval es la consciencia de Víctor.,,60,11,20,2,55,8,36,6,del toro elogia la actuación de actor como henry clerval,entrevista backstage,el director destaca el soporte emocional del personaje,clerval es la consciencia de víctor
191,Generacion Z,El uso de códigos y emojis en la convocatoria,Wired,2025-11-15,Análisis de cómo se organizan secretamente.,La Gen Z inventa sus propios códigos para la seguridad.,,45,9,5,1,43,6,55,10,el uso de códigos y emojis en la convocatoria,wired,análisis de cómo se organizan secretamente,la gen z inventa sus propios códigos para la seguridad
192,Frankenstein,Los coleccionables de Frankenstein se agotan en línea,Merchandise News,2025-11-13,Figuras y pósters de edición limitada.,El merchandising es un éxito rotundo.,,53,8,16,2,38,6,37,6,los coleccionables de frankenstein se agotan en línea,merchandise news,figuras y pósters de edición limitada,el merchandising es un éxito rotundo
193,Generacion Z,Medios internacionales critican la respuesta del gobierno,The New York Times,2025-11-17,La reacción oficial es vista como minimización.,El mundo observa el trato a los manifestantes.,,57,7,18,4,47,7,46,8,medios internacionales critican la respuesta del gobierno,the new york times,la reacción oficial es vista como minimización,el mundo observa el trato a los manifestantes
194,Frankenstein,Frankenstein: Una clase magistral de diseño de sonido,Audio Post,2025-11-10,El uso del silencio y los efectos de sonido gutural.,El diseño de sonido es perturbador y brillante.,,53,8,10,2,52,10,47,8,frankenstein una clase magistral de diseño de sonido,audio post,el uso del silencio y los efectos de sonido gutural,el diseño de sonido es perturbador y brillante
195,Generacion Z,Testimonios de desalojo en la Alameda Central,Diario de México,2025-11-16,Cuentas de primera mano sobre la intervención policial.,La violencia no nos va a detener.,,45,7,16,3,55,8,33,7,testimonios de desalojo en la alameda central,diario de méxico,cuentas de primera mano sobre la intervención policial,la violencia no nos va a detener
196,Frankenstein,"Del Toro: ""Es una tragedia sobre la paternidad fallida""",Focus Features,2025-11-05,El director se enfoca en la responsabilidad del creador.,Un tema universal que Del Toro maneja con maestría.,,55,9,14,2,56,9,51,9,del toro es una tragedia sobre la paternidad fallida,focus features,el director se enfoca en la responsabilidad del creador,un tema universal que del toro maneja con maestría
197,Generacion Z,Las 'Fake News' sobre la marcha: Desmentidos de la Gen Z,VerificadorMx,2025-11-15,Jóvenes usan sus redes para desmentir rumores oficiales.,La Gen Z lucha contra la desinformación en tiempo real.,,56,11,13,1,56,8,55,10,las fake news sobre la marcha desmentidos de la gen z,verificadormx,jóvenes usan sus redes para desmentir rumores oficiales,la gen z lucha contra la desinformación en tiempo real
