ID,Categoria,Titulo,Medio,Fecha,Resumen,Comentario_Reaccion,Unnamed: 7,Titulo_longitud,Titulo_num_palabras,Medio_longitud,Medio_num_palabras,Resumen_longitud,Resumen_num_palabras,Comentario_Reaccion_longitud,Comentario_Reaccion_num_palabras,Titulo_limpio,Medio_limpio,Resumen_limpio,Comentario_Reaccion_limpio
65,Generacion Z,Reporte de Derechos Humanos condena uso excesivo de la fuerza,Amnistía Internacional,2025-11-17,Documentan agresiones a manifestantes pacíficos.,El estado no respeta nuestros derechos.,,61,10,22,2,48,5,39,6,reporte de derechos humanos condena uso excesivo de la fuerza,amnistía internacional,documentan agresiones a manifestantes pacíficos,el estado no respeta nuestros derechos
66,Frankenstein,Guillermo del Toro anuncia un libro de arte de la película,Dark Horse Comics,2025-11-14,El tomo contendrá bocetos y diseños conceptuales.,¡Comprado! Necesito ver el proceso creativo de GDT.,,58,11,17,3,49,7,51,8,guillermo del toro anuncia un libro de arte de la película,dark horse comics,el tomo contendrá bocetos y diseños conceptuales,comprado necesito ver el proceso creativo de gdt
67,Generacion Z,Economistas advierten sobre el impacto de la inestabilidad social,Financial Times,2025-11-18,Las protestas pueden afectar la inversión extranjera.,La inestabilidad la crea el gobierno que no escucha.,,65,9,15,2,53,7,52,9,economistas advierten sobre el impacto de la inestabilidad social,financial times,las protestas pueden afectar la inversión extranjera,la inestabilidad la crea el gobierno que no escucha
68,Frankenstein,Frankenstein y el cine gótico: Un regreso a las raíces,Horror Freak,2025-11-05,La película abraza la tradición del horror clásico.,Un homenaje perfecto a los monstruos de antaño.,,54,10,12,2,51,8,47,8,frankenstein y el cine gótico un regreso a las raíces,horror freak,la película abraza la tradición del horror clásico,un homenaje perfecto a los monstruos de antaño
69,Generacion Z,Manifestantes utilizan drones para documentar la marcha,Tecnología para el Cambio,2025-11-16,Cámaras aéreas registran la magnitud de la concentración.,Los drones muestran la verdad que los medios no quieren ver.,,55,7,25,4,57,8,60,11,manifestantes utilizan drones para documentar la marcha,tecnología para el cambio,cámaras aéreas registran la magnitud de la concentración,los drones muestran la verdad que los medios no quieren ver
70,Frankenstein,"Del Toro agradece el recibimiento: ""Una obra personal""",Discurso de Premiere,2025-10-30,El director se emociona al hablar de su conexión con la historia.,Se siente la pasión en cada fotograma.,,54,8,20,3,65,12,38,7,del toro agradece el recibimiento una obra personal,discurso de premiere,el director se emociona al hablar de su conexión con la historia,se siente la pasión en cada fotograma
71,Generacion Z,Comentarios: La marcha dividió a las familias,Foros de Debate,2025-11-17,Generaciones mayores critican la falta de respeto a la autoridad.,Mis papás no entienden por qué salgo a la calle.,,45,7,15,3,65,10,48,10,comentarios la marcha dividió a las familias,foros de debate,generaciones mayores critican la falta de respeto a la autoridad,mis papás no entienden por qué salgo a la calle
72,Frankenstein,El Monstruo de Del Toro: ¿El más vulnerable de todos?,Film Comment,2025-11-10,El análisis de la interpretación de [Actor 2] como figura trágica.,Su vulnerabilidad es lo que lo hace tan humano.,,53,10,12,2,66,11,47,9,el monstruo de del toro el más vulnerable de todos,film comment,el análisis de la interpretación de actor como figura trágica,su vulnerabilidad es lo que lo hace tan humano
73,Generacion Z,Influencers promueven boicot a marcas que no se pronuncian,TikTok,2025-11-15,Piden a las empresas tomar posición política.,"Si las marcas no nos apoyan, no las consumimos.",,58,9,6,1,45,7,47,9,influencers promueven boicot a marcas que no se pronuncian,tiktok,piden a las empresas tomar posición política,si las marcas no nos apoyan no las consumimos
74,Frankenstein,Frankenstein: Un éxito inesperado de Netflix Latam,Netflix Data,2025-11-14,La película se posiciona como la más vista en la región.,¡Qué orgullo para un director mexicano!,,50,7,12,2,56,11,39,6,frankenstein un éxito inesperado de netflix latam,netflix data,la película se posiciona como la más vista en la región,qué orgullo para un director mexicano
75,Generacion Z,La voz de la Generación Z en los medios tradicionales,Prensa Libre,2025-11-18,Los medios dan más espacio a las demandas de los jóvenes.,Es bueno que por fin nos escuchen en la radio.,,53,10,12,2,57,11,46,10,la voz de la generación z en los medios tradicionales,prensa libre,los medios dan más espacio a las demandas de los jóvenes,es bueno que por fin nos escuchen en la radio
76,Frankenstein,"Del Toro sobre el final: ""Un toque de esperanza""",Entrevista Exclusiva,2025-11-07,El director defiende un cierre menos nihilista.,Un final con esa pequeña luz es muy Del Toro.,,48,9,20,2,47,7,45,10,del toro sobre el final un toque de esperanza,entrevista exclusiva,el director defiende un cierre menos nihilista,un final con esa pequeña luz es muy del toro
77,Generacion Z,Activistas denuncian detenciones arbitrarias,ONG Derechos Humanos,2025-11-16,Piden la liberación inmediata de los detenidos.,La represión es la respuesta del miedo.,,44,4,20,3,47,7,39,7,activistas denuncian detenciones arbitrarias,ong derechos humanos,piden la liberación inmediata de los detenidos,la represión es la respuesta del miedo
78,Frankenstein,El impacto de la película en la moda gótica actual,Fashionista,2025-11-10,Las tendencias de vestuario de la película inspiran nuevos looks.,"Me copio el look de Victor, muy elegante y oscuro.",,50,10,11,1,65,10,50,10,el impacto de la película en la moda gótica actual,fashionista,las tendencias de vestuario de la película inspiran nuevos looks,me copio el look de victor muy elegante y oscuro
79,Generacion Z,Análisis de los cánticos y consignas de la marcha,Lingüística Social,2025-11-17,El uso del sarcasmo y el humor negro en las protestas.,La mejor forma de protestar es con inteligencia y humor.,,49,9,18,2,54,11,56,10,análisis de los cánticos y consignas de la marcha,lingüística social,el uso del sarcasmo y el humor negro en las protestas,la mejor forma de protestar es con inteligencia y humor
80,Frankenstein,Frankenstein en el Top 10 de IMDb,IMDb Charts,2025-11-15,La película mantiene una alta calificación entre los usuarios.,Una joya que será un clásico instantáneo.,,33,7,11,2,62,9,41,7,frankenstein en el top de imdb,imdb charts,la película mantiene una alta calificación entre los usuarios,una joya que será un clásico instantáneo
81,Generacion Z,Usuarios de Reddit discuten la efectividad de las marchas,Reddit r/Mexico,2025-11-18,Debate sobre si el cambio se logra en la calle o en las urnas.,"Ambos. La calle presiona, la urna decide.",,57,9,15,2,62,14,41,7,usuarios de reddit discuten la efectividad de las marchas,reddit rmexico,debate sobre si el cambio se logra en la calle o en las urnas,ambos la calle presiona la urna decide
82,Frankenstein,La crítica elogia la cinematografía en blanco y negro (Versión especial),Sundance Review,2025-11-12,Se lanzó una edición limitada en blanco y negro para cines.,El B&N le da un aire más clásico y dramático.,,72,11,15,2,59,11,45,10,la crítica elogia la cinematografía en blanco y negro versión especial,sundance review,se lanzó una edición limitada en blanco y negro para cines,el bn le da un aire más clásico y dramático
83,Generacion Z,Cobertura en vivo de la marcha es la más vista en Facebook,Facebook Live,2025-11-16,Miles de personas siguieron la transmisión en tiempo real.,"Vi todo desde casa, me sentí parte de ello.",,58,12,13,2,58,9,43,9,cobertura en vivo de la marcha es la más vista en facebook,facebook live,miles de personas siguieron la transmisión en tiempo real,vi todo desde casa me sentí parte de ello
85,Generacion Z,La Generación Z y su relación con el pasado político,Revista Nexos,2025-11-17,Los jóvenes critican a generaciones anteriores por la inacción.,"Heredamos un país roto, nos toca arreglarlo.",,52,10,13,2,63,9,44,7,la generación z y su relación con el pasado político,revista nexos,los jóvenes critican a generaciones anteriores por la inacción,heredamos un país roto nos toca arreglarlo
86,Frankenstein,Actriz [Actriz 3] sobre el rol femenino en la historia,Women in Film,2025-11-11,El papel de las mujeres en la nueva adaptación.,Los personajes femeninos son más fuertes y complejos.,,54,10,13,3,47,9,53,8,actriz actriz sobre el rol femenino en la historia,women in film,el papel de las mujeres en la nueva adaptación,los personajes femeninos son más fuertes y complejos
87,Generacion Z,"Marcha es calificada como ""evento generacional""",Analistas Políticos,2025-11-18,Se compara el impacto cultural con el Vive Latino.,Un evento que marcará a esta generación.,,47,6,19,2,50,9,40,7,marcha es calificada como evento generacional,analistas políticos,se compara el impacto cultural con el vive latino,un evento que marcará a esta generación
88,Frankenstein,Frankenstein es la película más tuiteada de la semana,Twitter Trends,2025-11-08,Millones de menciones sobre el estreno.,"El hype es real, todos están hablando de ella.",,53,9,14,2,39,6,46,9,frankenstein es la película más tuiteada de la semana,twitter trends,millones de menciones sobre el estreno,el hype es real todos están hablando de ella
89,Generacion Z,Grupos de apoyo legal asisten a detenidos,Pro Bono México,2025-11-16,Abogados ofrecen ayuda gratuita a los arrestados.,La solidaridad legal es clave en las protestas.,,41,7,15,3,49,7,47,8,grupos de apoyo legal asisten a detenidos,pro bono méxico,abogados ofrecen ayuda gratuita a los arrestados,la solidaridad legal es clave en las protestas
90,Frankenstein,Del Toro elogia la actuación de [Actor 4] como Henry Clerval,Entrevista Backstage,2025-11-07,El director destaca el soporte emocional del personaje.,Clerval es la única luz en la oscuridad del Dr. Frankenstein.,,60,11,20,2,55,8,61,11,del toro elogia la actuación de actor como henry clerval,entrevista backstage,el director destaca el soporte emocional del personaje,clerval es la única luz en la oscuridad del dr frankenstein
91,Generacion Z,El uso de códigos y emojis en la convocatoria,Wired,2025-11-15,Análisis de cómo se organizan secretamente.,Usamos códigos para evitar la censura.,,45,9,5,1,43,6,38,6,el uso de códigos y emojis en la convocatoria,wired,análisis de cómo se organizan secretamente,usamos códigos para evitar la censura
92,Frankenstein,Los coleccionables de Frankenstein se agotan en línea,Merchandise News,2025-11-13,Figuras y pósters de edición limitada.,Quiero el Funko Pop del Monstruo inmediatamente.,,53,8,16,2,38,6,48,7,los coleccionables de frankenstein se agotan en línea,merchandise news,figuras y pósters de edición limitada,quiero el funko pop del monstruo inmediatamente
93,Generacion Z,Medios internacionales critican la respuesta del gobierno,The New York Times,2025-11-17,La reacción oficial es vista como minimización.,El mundo está viendo cómo nos tratan.,,57,7,18,4,47,7,37,7,medios internacionales critican la respuesta del gobierno,the new york times,la reacción oficial es vista como minimización,el mundo está viendo cómo nos tratan
94,Frankenstein,Frankenstein: Una clase magistral de diseño de sonido,Audio Post,2025-11-10,El uso del silencio y los efectos de sonido gutural.,El sonido del latido del Monstruo es aterrador.,,53,8,10,2,52,10,47,8,frankenstein una clase magistral de diseño de sonido,audio post,el uso del silencio y los efectos de sonido gutural,el sonido del latido del monstruo es aterrador
95,Generacion Z,Testimonios de desalojo en la Alameda Central,Diario de México,2025-11-16,Cuentas de primera mano sobre la intervención policial.,Fue violento y desproporcionado.,,45,7,16,3,55,8,32,4,testimonios de desalojo en la alameda central,diario de méxico,cuentas de primera mano sobre la intervención policial,fue violento y desproporcionado
96,Frankenstein,"Del Toro: ""Es una tragedia sobre la paternidad fallida""",Focus Features,2025-11-05,El director se enfoca en la responsabilidad del creador.,Es la peor historia de un papá que abandona a su hijo.,,55,9,14,2,56,9,54,12,del toro es una tragedia sobre la paternidad fallida,focus features,el director se enfoca en la responsabilidad del creador,es la peor historia de un papá que abandona a su hijo
97,Generacion Z,Las 'Fake News' sobre la marcha: Desmentidos de la Gen Z,VerificadorMx,2025-11-15,Jóvenes usan sus redes para desmentir rumores oficiales.,Nos toca a nosotros ser los verificadores.,,56,11,13,1,56,8,42,7,las fake news sobre la marcha desmentidos de la gen z,verificadormx,jóvenes usan sus redes para desmentir rumores oficiales,nos toca a nosotros ser los verificadores
98,Frankenstein,Frankenstein se proyecta en la Cineteca Nacional,Cineteca Agenda,2025-10-28,Función especial con presencia de críticos.,Verla en la Cineteca es un ritual.,,48,7,15,2,43,6,34,7,frankenstein se proyecta en la cineteca nacional,cineteca agenda,función especial con presencia de críticos,verla en la cineteca es un ritual
99,Generacion Z,Impacto en la cultura pop: Músicos se unen a la protesta,Rolling Stone MX,2025-11-17,Bandas de rock y rap se pronuncian y donan fondos.,La música siempre ha estado con el movimiento.,,56,11,16,3,50,10,46,8,impacto en la cultura pop músicos se unen a la protesta,rolling stone mx,bandas de rock y rap se pronuncian y donan fondos,la música siempre ha estado con el movimiento
100,Frankenstein,La controversia del casting en redes sociales,Twitter Debate,2025-11-04,Discusión sobre la elección de un actor 'demasiado guapo'.,"El maquillaje lo arregla, pero la esencia es Del Toro.",,45,7,14,2,58,9,54,10,la controversia del casting en redes sociales,twitter debate,discusión sobre la elección de un actor demasiado guapo,el maquillaje lo arregla pero la esencia es del toro
101,Generacion Z,Gen Z-styled protests spread in Mexico,Reuters,2025-11-16,Protestas tras asesinato de alcalde; enfrentamientos con policía.,El hartazgo juvenil es evidente en cada pancarta.,,38,6,7,1,65,8,49,8,gen zstyled protests spread in mexico,reuters,protestas tras asesinato de alcalde enfrentamientos con policía,el hartazgo juvenil es evidente en cada pancarta
102,Frankenstein,Frankenstein ya en streaming,Netflix Tudum,2025-11-07,La película se estrena en Netflix; estructura en tres actos.,"La mejor adaptación del clásico en décadas, ¡imperdible!",,28,4,13,2,60,10,56,8,frankenstein ya en streaming,netflix tudum,la película se estrena en netflix estructura en tres actos,la mejor adaptación del clásico en décadas imperdible
103,Generacion Z,Sheinbaum desautoriza marcha de la generación Z,El País,2025-11-17,Gobierno señala baja participación juvenil y presencia de opositores adultos.,"No importa cuántos éramos, sino el mensaje que dimos.",,47,7,7,2,77,10,53,9,sheinbaum desautoriza marcha de la generación z,el país,gobierno señala baja participación juvenil y presencia de opositores adultos,no importa cuántos éramos sino el mensaje que dimos
104,Frankenstein,Del Toro visita CDMX por estreno,Milenio,2025-10-30,Del Toro y elenco asistirán a evento en Ciudad de México.,México celebra a su genio del cine. ¡Un orgullo!,,32,6,7,1,57,11,48,9,del toro visita cdmx por estreno,milenio,del toro y elenco asistirán a evento en ciudad de méxico,méxico celebra a su genio del cine un orgullo
105,Generacion Z,Gobierno vincula marcha con desinformación,El País,2025-11-13,Acusan campaña digital financiada con bots e influencers.,"Si el gobierno lo niega, es porque es verdad lo que decimos.",,42,5,7,2,57,8,60,12,gobierno vincula marcha con desinformación,el país,acusan campaña digital financiada con bots e influencers,si el gobierno lo niega es porque es verdad lo que decimos
106,Frankenstein,Estreno en cines mexicanos,TV Azteca,2025-10-23,Se proyecta solo en cines seleccionados e independientes.,Una experiencia cinematográfica que vale cada peso.,,26,4,9,2,57,8,51,7,estreno en cines mexicanos,tv azteca,se proyecta solo en cines seleccionados e independientes,una experiencia cinematográfica que vale cada peso
107,Generacion Z,Generación Z toma las calles,Euronews,2025-11-16,20 detenidos y 100 policías heridos en movilizaciones.,La tensión en las calles es insostenible.,,28,5,8,1,54,8,41,7,generación z toma las calles,euronews,detenidos y policías heridos en movilizaciones,la tensión en las calles es insostenible
108,Frankenstein,Frankenstein llega a Netflix,El Financiero,2025-11-04,Disponible en streaming desde el 7 de noviembre.,Lista para verla 3 veces seguidas. ¡Qué obra!,,28,4,13,2,48,8,45,8,frankenstein llega a netflix,el financiero,disponible en streaming desde el de noviembre,lista para verla veces seguidas qué obra
109,Generacion Z,Testimonios de jóvenes sobre protesta,El País,2025-11-16,"Jóvenes denuncian inseguridad, falta de medicinas y problemas sociales.","La protesta es multifactorial, no es solo un tema.",,37,5,7,2,71,9,50,9,testimonios de jóvenes sobre protesta,el país,jóvenes denuncian inseguridad falta de medicinas y problemas sociales,la protesta es multifactorial no es solo un tema
110,Frankenstein,13 minutos de aplausos en Venecia,El Financiero,2025-08-31,La película recibe ovación en el Festival de Venecia.,Merecidos aplausos para el maestro Del Toro.,,33,6,13,2,53,9,44,7,minutos de aplausos en venecia,el financiero,la película recibe ovación en el festival de venecia,merecidos aplausos para el maestro del toro
111,Generacion Z,Análisis: ¿Qué busca realmente la Gen Z en las marchas?,BBC Mundo,2025-11-18,Estudio indica desconfianza en instituciones y uso de memes como protesta.,El meme es la herramienta de la sátira política moderna.,,55,10,9,2,74,11,56,10,análisis qué busca realmente la gen z en las marchas,bbc mundo,estudio indica desconfianza en instituciones y uso de memes como protesta,el meme es la herramienta de la sátira política moderna
112,Frankenstein,Oscar a Mejor Maquillaje asegurado para GDT,Variety,2025-11-15,Expertos predicen múltiples nominaciones por el diseño del Monstruo.,El maquillaje te cuenta toda la historia del sufrimiento del Monstruo.,,43,7,7,1,68,9,70,11,oscar a mejor maquillaje asegurado para gdt,variety,expertos predicen múltiples nominaciones por el diseño del monstruo,el maquillaje te cuenta toda la historia del sufrimiento del monstruo
113,Generacion Z,El factor TikTok en las protestas mexicanas,DW,2025-11-15,La red social es la principal herramienta de convocatoria y difusión.,El algoritmo nos unió por la causa.,,43,7,2,1,69,11,35,7,el factor tiktok en las protestas mexicanas,dw,la red social es la principal herramienta de convocatoria y difusión,el algoritmo nos unió por la causa
114,Frankenstein,La nueva visión de la criatura de Del Toro,Rolling Stone,2025-11-08,El director se enfoca en la soledad y la humanidad del Monstruo.,Es más sobre la víctima que sobre el villano.,,42,9,13,2,64,12,45,9,la nueva visión de la criatura de del toro,rolling stone,el director se enfoca en la soledad y la humanidad del monstruo,es más sobre la víctima que sobre el villano
115,Generacion Z,Marcha: ¿El inicio de un nuevo movimiento juvenil?,Reforma,2025-11-17,Sociólogos debaten si las protestas tienen el potencial de la Primavera Árabe.,Los cambios generacionales empiezan con una chispa así.,,50,8,7,1,78,12,55,8,marcha el inicio de un nuevo movimiento juvenil,reforma,sociólogos debaten si las protestas tienen el potencial de la primavera árabe,los cambios generacionales empiezan con una chispa así
116,Frankenstein,Elenco de lujo cautiva a la audiencia global,Hollywood Reporter,2025-11-09,Análisis de las actuaciones de [Actor 1] y [Actor 2] como Dr. y Monstruo.,[Actor 1] logra una frialdad increíble como Dr. Frankenstein.,,44,8,18,2,73,14,61,9,elenco de lujo cautiva a la audiencia global,hollywood reporter,análisis de las actuaciones de actor y actor como dr y monstruo,actor logra una frialdad increíble como dr frankenstein
117,Generacion Z,Gobierno refuerza seguridad en el Zócalo,Milenio,2025-11-14,"Tras el intento de ocupación, se duplica la presencia policial.",Blindan el poder en lugar de abrir el diálogo.,,40,6,7,1,63,10,46,9,gobierno refuerza seguridad en el zócalo,milenio,tras el intento de ocupación se duplica la presencia policial,blindan el poder en lugar de abrir el diálogo
118,Frankenstein,Frankenstein: ¿La obra maestra más oscura de GDT?,IndieWire,2025-11-10,Comparación con El Laberinto del Fauno y La Forma del Agua.,"La más cruda y menos fantástica, una joya.",,49,8,9,1,59,11,42,8,frankenstein la obra maestra más oscura de gdt,indiewire,comparación con el laberinto del fauno y la forma del agua,la más cruda y menos fantástica una joya
119,Generacion Z,¿Quién financia la movilización digital de la Gen Z?,El Universal,2025-11-13,Investigación sobre el origen de los hashtags virales.,Nuestra única moneda es la indignación.,,52,9,12,2,54,8,39,6,quién financia la movilización digital de la gen z,el universal,investigación sobre el origen de los hashtags virales,nuestra única moneda es la indignación
120,Frankenstein,La estética victoriana y el detalle de producción,Screen Rant,2025-11-06,Entrevista con la diseñadora de producción sobre el mundo de la película.,"Cada detalle te transporta a la época, maestría total.",,49,8,11,2,73,12,54,9,la estética victoriana y el detalle de producción,screen rant,entrevista con la diseñadora de producción sobre el mundo de la película,cada detalle te transporta a la época maestría total
121,Generacion Z,Estudiantes se suman a las demandas de la marcha,La Jornada,2025-11-15,Facultades de la UNAM y el IPN emiten comunicados de apoyo.,Las universidades son el motor del cambio.,,48,9,10,2,59,11,42,7,estudiantes se suman a las demandas de la marcha,la jornada,facultades de la unam y el ipn emiten comunicados de apoyo,las universidades son el motor del cambio
122,Frankenstein,Tráiler rompe récord de vistas en Netflix,Forbes,2025-10-01,El avance de la película se vuelve viral en horas.,"El tráiler no le hace justicia, la película es mucho mejor.",,41,7,6,1,50,10,59,11,tráiler rompe récord de vistas en netflix,forbes,el avance de la película se vuelve viral en horas,el tráiler no le hace justicia la película es mucho mejor
123,Generacion Z,Influencers denuncian intimidación tras apoyar las protestas,El País,2025-11-17,Cuentas grandes reportan ataques coordinados y amenazas.,El precio de alzar la voz es alto.,,60,7,7,2,56,7,34,8,influencers denuncian intimidación tras apoyar las protestas,el país,cuentas grandes reportan ataques coordinados y amenazas,el precio de alzar la voz es alto
124,Frankenstein,"Del Toro sobre la ciencia: ""Es la ambición humana""",The Guardian,2025-11-07,Cita del director sobre el verdadero horror de la historia.,La arrogancia del Dr. es la verdadera tragedia.,,50,9,12,2,59,10,47,8,del toro sobre la ciencia es la ambición humana,the guardian,cita del director sobre el verdadero horror de la historia,la arrogancia del dr es la verdadera tragedia
125,Generacion Z,México: La generación del cambio social,CNN Español,2025-11-18,Reportaje especial sobre el activismo juvenil en Latam.,Gen Z está definiendo la política en México.,,39,6,11,2,55,8,44,8,méxico la generación del cambio social,cnn español,reportaje especial sobre el activismo juvenil en latam,gen z está definiendo la política en méxico
126,Frankenstein,Critica: La obra que define la filmografía de Del Toro,SensaCine,2025-11-05,Una reseña que alaba la madurez narrativa y visual del director.,Una lección de cómo adaptar un clásico.,,54,10,9,1,64,11,39,7,critica la obra que define la filmografía de del toro,sensacine,una reseña que alaba la madurez narrativa y visual del director,una lección de cómo adaptar un clásico
127,Generacion Z,Padres de familia expresan apoyo a la marcha de sus hijos,El Heraldo,2025-11-16,Adultos mayores se unen a las filas en solidaridad.,El apoyo de los padres es crucial para la moral.,,57,11,10,2,51,9,48,10,padres de familia expresan apoyo a la marcha de sus hijos,el heraldo,adultos mayores se unen a las filas en solidaridad,el apoyo de los padres es crucial para la moral
128,Frankenstein,Análisis: ¿Por qué Frankenstein sigue siendo relevante?,Vulture,2025-11-12,La historia toca temas de rechazo social y disidencia.,Refleja la ansiedad de sentirse diferente y excluido.,,55,7,7,1,54,9,53,8,análisis por qué frankenstein sigue siendo relevante,vulture,la historia toca temas de rechazo social y disidencia,refleja la ansiedad de sentirse diferente y excluido
129,Generacion Z,Hashtags de protesta se vuelven *trending* mundial,Twitter News,2025-11-15,#MexicoDespierta y #GenZPorLaPaz lideran tendencias.,La voz digital supera a la frontera.,,50,7,12,2,52,5,36,7,hashtags de protesta se vuelven trending mundial,twitter news,y lideran tendencias,la voz digital supera a la frontera
130,Frankenstein,Efectos visuales minimalistas y el poder de la caracterización,FX Magazine,2025-11-10,El uso de maquillaje práctico sobre CGI es un acierto.,La textura de la piel del Monstruo es increíblemente realista.,,62,9,11,2,54,10,62,10,efectos visuales minimalistas y el poder de la caracterización,fx magazine,el uso de maquillaje práctico sobre cgi es un acierto,la textura de la piel del monstruo es increíblemente realista
131,Generacion Z,Policía Cibernética investiga origen de desinformación,El País,2025-11-14,Señalan cuentas vinculadas a grupos de oposición.,Intentan deslegitimar el movimiento a toda costa.,,54,6,7,2,49,7,49,7,policía cibernética investiga origen de desinformación,el país,señalan cuentas vinculadas a grupos de oposición,intentan deslegitimar el movimiento a toda costa
